{
  "$schema": "http://json-schema.org/draft-07/schema#",
  "title": "Venues List Schema",
  "type": "array",
  "items": {
    "type": "object",
    "properties": {
      "id": { "type": "string" },
      "name": { "type": "string" },
      "type": { "type": "string" },
      "capacity": { "type": "integer" }
    },
    "required": ["id", "name", "type", "capacity"]
  }
}